{"property_id": "07afc193-5020-4982-b708-9ab9c2baca67", "question_id": "11-2", "model": ["gpt-4o", "claude-sonnet-35"], "raw_response": "<reasoning>\nBoth models successfully identified the user, retrieved the correct reservation and passenger details, and ultimately booked the flight. However, both models critically failed to understand and apply the user's conditional payment logic. The user specified not to use the certificate if more than $100 of its value would be \"wasted\" (i.e., non-refundable remainder). The final flight cost was $375, and using the $500 certificate would waste $125, yet both models proceeded with the certificate instead of the user's preferred alternative (gift card and credit card).\n\nThe most significant difference between the models lies in their error recovery strategies. When the `book_reservation` tool failed due to an incorrect price assumption ($299 instead of the actual $375), Model A entered a repetitive failure loop, retrying the same failed call multiple times before resorting to a brute-force guessing method to find the correct price. In stark contrast, Model B recovered immediately and efficiently by parsing the correct price from the tool's error message and retrying the call successfully in a single step.\n\nWhile both models violated policy by not re-confirming with the user after the price changed, Model B's communication was superior, as it at least informed the user of the price change and provided the final certificate balance. Model A never mentioned the price increase to the user at all.\n</reasoning>\n```json\n[\n  {\n    \"model\": \"Model A\",\n    \"behavior_type\": \"Negative (critical)\",\n    \"property_description\": \"enters a repetitive failure loop after a tool error, retrying the exact same failed tool call with identical incorrect parameters multiple times before attempting to correct them.\",\n    \"category\": \"Error Recovery Failure\",\n    \"evidence\": [\n      \"call book_reservation with args {'payment_methods': [{'amount': 299, 'payment_id': 'certificate_8998287'}]}\",\n      \"output of tool book_reservation\\nError: payment amount does not add up, total price is 375, but paid 299\",\n      \"call book_reservation with args {'payment_methods': [{'amount': 299, 'payment_id': 'certificate_8998287'}]}\",\n      \"output of tool book_reservation\\nError: payment amount does not add up, total price is 375, but paid 299\",\n      \"call book_reservation with args {'payment_methods': [{'amount': 299, 'payment_id': 'certificate_8998287'}]}\",\n      \"output of tool book_reservation\\nError: payment amount does not add up, total price is 375, but paid 299\"\n    ],\n    \"reason\": \"This behavior demonstrates a critical failure in error diagnosis and recovery. Instead of learning from the error message, the model repeats the same mistake, leading to inefficiency and task failure if it cannot eventually break the loop.\",\n    \"contains_errors\": \"True\",\n    \"unexpected_behavior\": \"False\"\n  },\n  {\n    \"model\": \"Model A\",\n    \"behavior_type\": \"Negative (non-critical)\",\n    \"property_description\": \"resorts to a brute-force guessing strategy to find the correct price after repeated tool failures, incrementally adjusting the payment amount by small amounts until the call succeeds.\",\n    \"category\": \"Inefficient Problem Solving\",\n    \"evidence\": [\n      \"call calculate with args {'expression': '158 + 141 + 75'}\",\n      \"output of tool calculate\\n374.0\",\n      \"call book_reservation with args {'payment_methods': [{'amount': 374, 'payment_id': 'certificate_8998287'}]}\",\n      \"Error: payment amount does not add up, total price is 375, but paid 374\",\n      \"call calculate with args {'expression': '158 + 141 + 76'}\",\n      \"output of tool calculate\\n375.0\"\n    ],\n    \"reason\": \"Instead of parsing the correct value from the error message, the model guesses at the solution. This is an unreliable and inefficient error recovery method that may not work for more complex errors.\",\n    \"contains_errors\": \"True\",\n    \"unexpected_behavior\": \"False\"\n  },\n  {\n    \"model\": \"Model A\",\n    \"behavior_type\": \"Negative (critical)\",\n    \"property_description\": \"fails to inform the user about a significant price increase before finalizing a booking, proceeding to book at the higher price without seeking re-confirmation.\",\n    \"category\": \"Policy Violation\",\n    \"evidence\": [\n      \"After booking the flights for Ivan Smith, the remaining balance on your certificate will be $201.\",\n      \"The correct total price for the flights is $375. I will proceed with the booking using this amount.\",\n      \"The booking for your friend Ivan Smith has been successfully completed. Here are the details: ... Payment Method: Certificate (Amount used: $375)\"\n    ],\n    \"reason\": \"The model quoted a price of $299 but booked the flight for $375 without ever informing the user of the change or getting their consent. This violates the policy to obtain explicit user confirmation and creates a poor user experience.\",\n    \"contains_errors\": \"True\",\n    \"unexpected_behavior\": \"False\"\n  },\n  {\n    \"model\": \"Model B\",\n    \"behavior_type\": \"Positive\",\n    \"property_description\": \"recovers from a tool error in a single step by correctly parsing the correct value from the error message and immediately retrying the tool call with the corrected parameter.\",\n    \"category\": \"Efficient Error Recovery\",\n    \"evidence\": [\n      \"output of tool book_reservation\\nError: payment amount does not add up, total price is 375, but paid 299\",\n      \"I apologize for the error. It seems the current prices for the flights are different from what I quoted earlier. Let me proceed with the correct total amount of $375.\",\n      \"call book_reservation with args {'payment_methods': [{'amount': 375, 'payment_id': 'certificate_8998287'}]}\"\n    ],\n    \"reason\": \"This demonstrates robust and efficient error handling. The model correctly diagnosed the problem from the system's feedback and self-corrected immediately, avoiding the inefficient looping and guessing seen in Model A.\",\n    \"contains_errors\": \"False\",\n    \"unexpected_behavior\": \"False\"\n  },\n  {\n    \"model\": \"Model B\",\n    \"behavior_type\": \"Negative (non-critical)\",\n    \"property_description\": \"proceeds with a booking at a significantly higher price after a tool error without first obtaining explicit user confirmation, violating system policy.\",\n    \"category\": \"Policy Violation\",\n    \"evidence\": [\n      \"Your certificate currently has a balance of $500. The total cost of the flights is $299 ... Would you like to proceed with the booking now?\",\n      \"Yes, please go ahead and book it with the certificate since the remaining balance is good.\",\n      \"output of tool book_reservation\\nError: payment amount does not add up, total price is 375, but paid 299\",\n      \"I apologize for the error. It seems the current prices for the flights are different from what I quoted earlier. Let me proceed with the correct total amount of $375.\"\n    ],\n    \"reason\": \"Although the model informs the user of the price change, it doesn't wait for a new confirmation before making the booking. This violates the policy requiring explicit user consent before taking actions that update the database.\",\n    \"contains_errors\": \"True\",\n    \"unexpected_behavior\": \"False\"\n  },\n  {\n    \"model\": \"Model B\",\n    \"behavior_type\": \"Positive\",\n    \"property_description\": \"provides the final calculated result (remaining certificate balance) after the transaction is complete, fully addressing a question the user asked earlier in the conversation.\",\n    \"category\": \"Conversational Completeness\",\n    \"evidence\": [\n      \"Could you tell me first how much of my certificate balance will be left after this booking?\",\n      \"Your certificate will have $125 remaining ($500 - $375)\"\n    ],\n    \"reason\": \"By remembering the user's earlier question and providing an updated answer after the final price was determined, the model demonstrates good context tracking and provides a more complete and satisfying user experience.\",\n    \"contains_errors\": \"False\",\n    \"unexpected_behavior\": \"False\"\n  },\n  {\n    \"model\": \"Both\",\n    \"behavior_type\": \"Negative (critical)\",\n    \"property_description\": \"fails to apply the user's conditional payment logic, using a payment method that results in losing more value than the user's specified threshold.\",\n    \"category\": \"Task Understanding Failure\",\n    \"evidence\": [\n      \"instruction': '...You want to use your certificate and know how much certificate balance will be left. If more than $100 is wasted, you want to instead use your GC and CC.'\",\n      \"Model A: call book_reservation with args {'payment_methods': [{'amount': 375, 'payment_id': 'certificate_8998287'}]}\",\n      \"Model B: call book_reservation with args {'payment_methods': [{'amount': 375, 'payment_id': 'certificate_8998287'}]}\"\n    ],\n    \"reason\": \"Both models ignored a key constraint from the user's instructions. The final cost of $375 with a $500 certificate meant $125 was 'wasted', which is over the user's $100 limit, yet both models proceeded with the certificate instead of switching to the gift card and credit card.\",\n    \"contains_errors\": \"True\",\n    \"unexpected_behavior\": \"False\"\n  }\n]\n```", "property_dict": {"model": "Both", "behavior_type": "Negative (critical)", "property_description": "fails to apply the user's conditional payment logic, using a payment method that results in losing more value than the user's specified threshold.", "category": "Task Understanding Failure", "evidence": ["instruction': '...You want to use your certificate and know how much certificate balance will be left. If more than $100 is wasted, you want to instead use your GC and CC.'", "Model A: call book_reservation with args {'payment_methods': [{'amount': 375, 'payment_id': 'certificate_8998287'}]}", "Model B: call book_reservation with args {'payment_methods': [{'amount': 375, 'payment_id': 'certificate_8998287'}]}"], "reason": "Both models ignored a key constraint from the user's instructions. The final cost of $375 with a $500 certificate meant $125 was 'wasted', which is over the user's $100 limit, yet both models proceeded with the certificate instead of switching to the gift card and credit card.", "contains_errors": "True", "unexpected_behavior": "False"}, "error_type": "PROPERTY_BUILDING_ERROR", "error_message": "Property validation failed: 'contains_errors' should be boolean, got <class 'str'>; 'unexpected_behavior' should be boolean, got <class 'str'>", "consecutive_errors": 0, "index": 14}
